{
  "schemaVersion": 2,
  "id": "wifi",
  "name": "WiFi",
  "version": "2.0.0",
  "kind": "shared",
  "contributes": {
    "widgets": [
      {
        "id": "wifi",
        "name": "WiFi",
        "slot": "right",
        "component": "WifiButton.qml",
        "order": 50,
        "alwaysShow": true,
        "moduleId": "wifi"
      }
    ],
    "popupSections": [
      {"id": "wifi", "type": "wifi", "name": "Wi-Fi Networks", "component": "WifiPopup.qml"}
    ]
  }
}
