{
  "schemaVersion": 2,
  "id": "power-indicator",
  "name": "Power Indicator",
  "version": "2.0.0",
  "kind": "shared",
  "contributes": {
    "widgets": [
      {
        "id": "powerIndicator",
        "name": "Power Indicator",
        "slot": "right",
        "component": "PowerIndicator.qml",
        "order": 95,
        "alwaysShow": true,
        "moduleId": "power-indicator"
      }
    ],
    "popupSections": [
      {"id": "battery", "type": "battery", "name": "Power & Battery", "component": "PowerPopup.qml"}
    ]
  }
}
