{
  "schemaVersion": 2,
  "id": "battery-power",
  "name": "Power & Battery",
  "description": "Battery monitoring, power profiles and session management",
  "version": "2.0.0",
  "kind": "shared",
  "contributes": {
    "services": ["battery", "power-profiles"],
    "popupSections": [
      {
        "type": "battery",
        "name": "Power",
        "component": "popup/BatteryPopup.qml"
      }
    ],
    "settingsPages": [
      {
        "id": "power",
        "title": "Power & Battery",
        "component": "settings/PowerPage.qml",
        "icon": "battery_charging_full",
        "order": 40
      }
    ]
  }
}
